{
  "schema_version": "system-status-v1",
  "generated_at": "2026-08-14T18:30:00+08:00",
  "source_manifest": {
    "schema_version": "current-state-manifest-v1",
    "generated_at": "2026-08-14T18:29:59+08:00",
    "sha256": "dddddddddddddddddddddddddddddddddddddddddddddddddddddddddddddddd"
  },
  "source_latest_date": null,
  "preview_generated_at": null,
  "public_generated_at": "2026-08-11T18:00:00+08:00",
  "lag_hours": null,
  "freshness_state": "blocked",
  "publish_state": "blocked",
  "blocked_reason": "source_missing",
  "artifact_health": {
    "ingestion": "missing",
    "preview": "missing",
    "public": "available",
    "agent_run": "unknown"
  },
  "advisory": true,
  "production_write": false,
  "publish_authority": "owner_only"
}
